title,date_published,author_name
Teacher Accountability Follows from Genuine Market Activity,2012-03-19,Michael A. LaFerrara
Georgia’s “Subpar” Day Care Centers Couldn’t Survive Capitalism,2012-03-19,Joshua Lipana
Scientists Need Not “Study” Psychic Nonsense to Reject It,2012-03-19,Ari Armstrong
African Slavery Highlights Evil of Involuntary Servitude,2012-03-18,Ari Armstrong
North Korea’s “National Script”: Yet Another Fair Warning,2012-03-17,Joseph Kellard
The Problem at Goldman Sachs Isn’t Greed but Irrationality,2012-03-17,Ryan Krause
The U.S. Should Rescue Gross and End the Castro Regime,2012-03-15,Joshua Lipana
"Encyclopaedia Britannica Ceases Printing, Marks Advance",2012-03-15,Ari Armstrong
Fonda’s Call to Censor Limbaugh Stems from Government Control of Airwaves,2012-03-14,Ari Armstrong
Anticapitalist Lorax Succeeds . . . Thanks to Capitalism,2012-03-13,Ari Armstrong
"Obama Administration Cuts Illegitimate Program, Conservatives Complain",2012-03-12,Ari Armstrong
Justice Department Unjustly Attacks Apple,2012-03-11,Ari Armstrong
Kudos to the Colorado Supreme Court for Upholding Concealed Carry On “Public” Campuses,2012-03-11,Ari Armstrong
Hope and Help for Africa Rests with Embrace and Example of Rights,2012-03-10,Ari Armstrong
Andrew Breitbart’s “So?”—A Great Question and Now a Worthy Charity,2012-03-09,Craig Biddle
"Temple Grandin, Justly Awarded and Profoundly Inspiring",2012-03-09,Ari Armstrong
Absurd Bill Sought to Ban “Discrimination” Against Raunchy Biker Attire,2012-03-08,Ari Armstrong
"Write Us a Song, and That’s Lucky Too",2012-03-07,Ari Armstrong
Chevy Volt Powers Down; Who Could Have Guessed?,2012-03-07,Ryan Krause
Judge Nixes Maryland’s Rights-Violating Handgun Restrictions,2012-03-06,Ari Armstrong
Why the Outrage Over Welfare for Strip Clubs?,2012-03-05,Ari Armstrong
“Hate Crime” Laws are Gateways for Censorship and Statism,2012-03-05,Michael A. LaFerrara
"In Fight for Property Rights, Institute for Justice Tops “Pyramid of Moral Endurance”",2012-03-04,Ari Armstrong
Oscar-Winning Hugo Celebrates Creative Genius of Méliès,2012-03-04,Ari Armstrong
"Bureaucrats Demand You Stop Smoking... and Stop Not Smoking, Too",2012-03-03,Ryan Krause
Elizabeth Price Foley: The Implication of the Individual Mandate is Unlimited,2012-03-03,Joshua Lipana
"Happy Birthday, Dr. Seuss—And Thanks for My Love of Reading",2012-03-02,Ari Armstrong
Limbaugh’s “Slut” Comment Typifies the Wrongs of the Right,2012-03-02,Ari Armstrong
Geithner and “Progressives” Favor Expanded Involuntary Servitude,2012-03-01,Ari Armstrong
Judge Tosses Rights-Violating Cigarette Labels,2012-03-01,Ari Armstrong
Jason Calacanis Nails It,2012-02-29,Daniel Wahl
Santorum “Throws Up” on Separation of Church and State,2012-02-29,Ari Armstrong
“Zombie Mohammed” Case Shows Western Capitulation to Islamist Barbarism,2012-02-28,Ari Armstrong
Iran Speeding Up Nuclear Work; Solution Remains the Same,2012-02-28,Joshua Lipana
Iranian Regime Renews Threat Against Israel; Solution Remains the Same,2012-02-27,Joshua Lipana
"Independent Reasoning, Not Prayer or Groupthink, Guides Fight Against Ravages of MS",2012-02-27,Ari Armstrong
Afghan Riots Indicate Deadly Consequences of Loving Our Enemies,2012-02-26,Ari Armstrong
Pope Immorally Condemns “Artificial Fertility”,2012-02-26,Ari Armstrong
Obama’s “Cruel Disregard” for the Sick—and the Well,2012-02-25,Michael A. LaFerrara
"Happy Birthday, Steve Jobs—and Thank You",2012-02-24,Ari Armstrong
Why Greece’s and America’s Economies Stink,2012-02-24,Ari Armstrong
Moral Justice Requires not Shuffling but Eliminating Corporate Taxes,2012-02-23,Ari Armstrong
A Rational U.S. Policy Regarding Iran and Saudi Arabia,2012-02-23,Craig Biddle
Fear Not “Satan” but Santorum,2012-02-22,Ari Armstrong
"My Interview with Cynthia Farahat, Now in Hebrew",2012-02-22,Joshua Lipana
Education “Stimulus” Thwarts Education,2012-02-21,Ari Armstrong
"""If You’re Looking for Brains, Just Stop at Israel""",2012-02-21,Gideon Reich
Interview with Boaz Arad on the Israeli Freedom Movement,2012-02-20,Craig Biddle
"From the Editor, Spring 2012",2012-02-20,Craig Biddle
Washington Guided the Constitutional Convention,2012-02-20,Ari Armstrong
Objectivism vs. Kantianism in The Fountainhead,2012-02-20,Andrew Bernstein
"Review: Mao’s Great Famine, by Frank Dikötter",2012-02-20,Daniel Wahl
"Individualism vs. Collectivism: Our Future, Our Choice",2012-02-20,Craig Biddle
Review: Eames: The Architect and the Painter,2012-02-20,Earl Parson
"Government Stimulus: $489,000 to Renovate a Yacht",2012-02-20,Joshua Lipana
Mysticism Claims More Victims,2012-02-19,Ari Armstrong
Obama Admin Seeking to Reestablish Funding for Evil UNESCO,2012-02-18,Joshua Lipana
Sasha DiGiulian: The Sight of an Achievement,2012-02-18,Craig Biddle
The Problem of Gary Johnson’s Libertarian Affiliation,2012-02-17,Ari Armstrong
A Note from Peter Huessy on Egypt,2012-02-17,Joshua Lipana
Government School Steams Parents Over Lunch Controls,2012-02-16,Ari Armstrong
Everyone Pays When Birth Control is “Free”,2012-02-16,Daniel Wahl
How the Catholic Church Paved the Way for the Birth Control Mandate,2012-02-15,Michael A. LaFerrara
"‘Keep Your Eyelids Up,’ Dr. Seuss Implores",2012-02-15,Ari Armstrong
FDA Shuts Down Farm for... Selling Fresh Milk,2012-02-14,Joshua Lipana
Facebook Provides an Enormous Value,2012-02-14,Ari Armstrong
Ignore Santorum’s Depraved Prescription: Have Sex for Pleasure this Valentine’s Day,2012-02-14,Ari Armstrong
Modern Greeks Destroy ‘Foundations of Justice’,2012-02-13,Ari Armstrong
Should a “homosexual contract” be called something other than marriage?,2012-02-13,Michael A. LaFerrara
A Vital Truth for Valentine’s Day: Say’s Law and Romantic Love,2012-02-12,Craig Biddle
"As Kodak Exits Camera Business, Remember the Genius of George Eastman",2012-02-12,Ari Armstrong
"The Government Should Extend Freedom, not HARP",2012-02-11,Michael A. LaFerrara
"Interview with Cynthia Farahat on Growing Up in Egypt, Discovering Ayn Rand, and Fighting Islamists",2012-02-10,Joshua Lipana
End Tax Favoritism for Wind Energy,2012-02-08,Ari Armstrong
Liability Reform Shouldn’t Be Limited to Space Industry,2012-02-08,Ari Armstrong
Not Only Catholics Should be Angered by Birth Control Mandates,2012-02-08,Ari Armstrong
Israel Should Obliterate the Iranian Regime,2012-02-06,Joshua Lipana
Message to Gov. Christie and His Critics: Gay Marriage is a Moral Right,2012-02-06,Michael A. LaFerrara
The Key to Eating and Acting Without Regret,2012-02-04,Daniel Wahl
Human Rights Watch is Wrong on Islam and Politics,2012-02-04,Joshua Lipana
Three Ways iDoneThis Helps Me Get Things Done,2012-02-02,Daniel Wahl
What's So Super About the Super Bowl?,2012-02-02,Joseph Kellard
There is No ‘Right to Work’ Against an Employer’s Consent,2012-02-01,Ari Armstrong
Texas Anti-Abortion Law Violates Rights to Liberty and Freedom of Speech,2012-01-31,Ari Armstrong
The Grey: A Great Reminder of Crucial Truths,2012-01-30,Paul Hsieh
Gingrich Seeks to Violate Rights of Women and Doctors to Engage in Fertility Care,2012-01-30,Ari Armstrong
"Obama Should Help End All Energy Subsidies, Not Play Favorites",2012-01-28,Ari Armstrong
Warren Buffett Immorally Calls for Tax Hikes on Top Producers,2012-01-27,Ari Armstrong
"Great Producers Deserve Our Gratitude, Not Obama’s Tax Hikes",2012-01-26,Ari Armstrong
Mitch Daniels: Business is “One of the Noblest of Human Pursuits”,2012-01-26,Joshua Lipana
"To Give Americans a “Fair Shot,” Obama Should Stop Violating Our Rights",2012-01-25,Ari Armstrong
Double-Taxation Means Double Injustice for Romney,2012-01-25,Ari Armstrong
Romney Should Call for Property Rights and Lower Taxes for Everyone,2012-01-24,Ari Armstrong
Obama’s “Tough Talk” Regarding Syria’s Membership in UNESCO Body is Immorally Inadequate,2012-01-23,Joshua Lipana
The Immorality of a “Reasonable Profits Board”,2012-01-22,Trevor Conn
Did God Help the Patriots Beat the Broncos?,2012-01-15,Ari Armstrong
High Time to End the Iranian Regime,2012-01-14,Joshua Lipana
"Interview with Peter Huessy on U.S. Foreign Policy, Iran, and the Middle East",2012-01-12,Craig Biddle
Who Deserves Credit for Tebow’s 316 Yards?,2012-01-09,Ari Armstrong
"Even with Gary Johnson, the Libertarian Party Undermines Liberty",2012-01-09,Ari Armstrong
Santorum Stands for Big Government because He Stands for Collectivism,2012-01-04,Ari Armstrong
Interview with Clare M. Lopez on Islam and the Enemies of America,2011-12-30,Craig Biddle
U.N. Pays Tribute to Communist Butcher,2011-12-28,Joshua Lipana
Newt Sides with Anti-Abortion Zealots,2011-12-22,Ari Armstrong
Did the U.S. government secretly plan for a drone to crash in Iran?,2011-12-20,Daniel Wahl
Orville and Wilbur: Men of the Mind,2011-12-17,Daniel Wahl
Obama’s Osawatomie Shakedown: Critics’ Roundup,2011-12-15,Ari Armstrong
Never Count a Good Author Out,2011-12-10,Daniel Wahl
"To Protect Rights, Phase Out Payroll Tax Completely",2011-12-09,Ari Armstrong
"Contra Occupiers, Profits Embody Justice",2011-12-02,Ari Armstrong
A Pledge for GOP Presidential Contenders: Repudiate the U.N. Wholesale,2011-11-28,Joshua Lipana
Spain Ousts Socialists—Will Spaniards Seize Opportunity for Freedom?,2011-11-23,Joshua Lipana
"Call It Exuberant Friday, Not “Black Friday”",2011-11-23,Ari Armstrong
"The American Right, the Purpose of Government, and the Future of Liberty",2011-11-20,Craig Biddle
"Review: The Right to Earn a Living, by Timothy Sandefur",2011-11-20,Loribeth Kowalski
"Review: Steve Jobs, by Walter Isaacson",2011-11-20,Daniel Wahl
The Patience of Jobs,2011-11-20,Daniel Wahl
"From the Editor, Winter 2011",2011-11-20,Craig Biddle
"Review: Keynes Hayek, by Nicholas Wapshott",2011-11-20,Richard M. Salsman
"Don’t Say Grace, Say Justice",2011-11-16,Craig Biddle
Democrats Further Entrench Rights-Violating Net Neutrality Regulations,2011-11-15,Joshua Lipana
FDA Bans Life-Saving Asthma Medications to Protect Ozone,2011-11-06,Joshua Lipana
UNESCO Embraces PLO Terrorists,2011-11-02,Joshua Lipana
Newt’s Outrageous Package Deal: Secularism and Islam,2011-10-30,Joshua Lipana
Student Loan Scheme Just Another Rights-Violating Bailout,2011-10-28,Ari Armstrong
"Yes, President Obama, We Can’t Wait...",2011-10-25,Ari Armstrong
Harry Reid and Company’s Latest Immoral Scheme,2011-10-16,Joshua Lipana
“Fair Tax” Offers Neither Fairness Nor Simplicity,2011-10-12,Ari Armstrong
How to Actually “Separate Government from the Corporations”,2011-10-11,Ari Armstrong
Steve Jobs' Philosophy of Life,2011-10-08,Craig Biddle
Fuel Controls Violate Rights and Stifle Markets,2011-10-07,Ari Armstrong
France Needs Laissez-Faire,2011-10-04,Joshua Lipana
"""Fair Tax"" Looks Ugly in the Details",2011-10-01,Ari Armstrong
Gates Foundation: Three Obvious Solutions Ignored,2011-09-30,Richard M. Salsman
Of Saudi Savages and American Children,2011-09-28,Craig Biddle
The United Nations’ Assault on Tobacco Companies,2011-09-23,Joshua Lipana
The Obama Downgrade,2011-09-21,Joshua Lipana
Don’t Bribe Pakistan; Warn It,2011-09-20,Joshua Lipana
Bachmann is Right on Eliminating DOE,2011-09-14,Joshua Lipana
American Tax Dollars Going to North Korea,2011-08-27,Joshua Lipana
Philippines: The Aquino Government Coddles the Communists Again,2011-08-22,Joshua Lipana
"From the Editor, Fall 2011",2011-08-20,Craig Biddle
An Interview with Sculptor Sandra J. Shaw,2011-08-20,Craig Biddle
Ayn Rand’s Theory of Rights: The Moral Foundation of a Free Society,2011-08-20,Craig Biddle
"Review: Gauntlet, by Barbara Masin",2011-08-20,John Cerasuolo
Cheers to Big Tobacco for Defending Itself,2011-08-18,Joshua Lipana
Reality to Ron Paul: Iran Seeks to Kill Americans,2011-08-13,Joshua Lipana
"Venezuela: No Octavio, The Chavez Government is Socialist",2011-08-11,Joshua Lipana
Interview with Karl Kowalski,2011-08-10,Daniel Wahl
Philippines: Destroy the Abu Sayyaf,2011-08-03,Joshua Lipana
Jim Demint’s “Retirement Freedom Act” is a Step in the Right Direction,2011-07-22,Joshua Lipana
What to Celebrate on the Fourth of July,2011-07-03,Craig Biddle
AT&T and T Mobile Have a Moral Right to Merge,2011-06-30,Joshua Lipana
Geert Wilders is Not Brave Enough to Be a Coward,2011-06-25,Craig Biddle
Kudos to Rick Perry for Vetoing an Internet Tax Bill,2011-06-24,Joshua Lipana
"TOS's Week in Review, May 31, 2011",2011-05-31,Craig Biddle
The Government’s Assault on Private-Sector Colleges and Universities,2011-05-20,Craig Biddle
The Iranian and Saudi Regimes Must Go,2011-05-20,Craig Biddle
ObamaCare v. the Constitution,2011-05-20,Paul J. Beard III
"From the Editor, Summer 2011",2011-05-20,Craig Biddle
"Review: The Infidel: Chapter One, by Bosch Fawstin",2011-05-20,Joshua Lipana
"Interview with Reza Kahlili, an Ex-CIA Spy Embedded in Iran’s Revolutionary Guards",2011-05-20,Craig Biddle
Review: Why ObamaCare is Wrong For America,2011-05-20,Jared M. Rhoads
"TOS's Week in Review for May 16, 2011",2011-05-17,Craig Biddle
"TOS's Week in Review for May 9, 2011",2011-05-09,Craig Biddle
Interview with Sean Saulsbury,2011-04-22,Daniel Wahl
Exploit-the-Earth Day,2011-04-18,Craig Biddle
A “Teal Movement” in Iran Could Be the End of the Regime: The U.S. Should Encourage It,2011-04-12,Craig Biddle
"Tea Party: ""Cut It or Shut It.""",2011-04-02,Joshua Lipana
Lee Bollinger: Let’s Force Americans to Broadcast Al Jazeera!,2011-03-16,Daniel Wahl
Chernobyl Schmernobyl: The Japanese are Competent,2011-03-15,Joshua Lipana
Economics in Atlas Shrugged,2011-02-20,Richard M. Salsman
"Review: Leaving Johnny Behind, by Anthony Pedriana",2011-02-20,Laura Hilse
"From the Editor, Spring 2011",2011-02-20,Craig Biddle
A Symphony of History: Will Durant’s The Story of Civilization,2011-02-20,Dan Norton
"Are ""Chinese Mothers"" Superior?",2011-01-26,Veronica Ryan
The Beauty of Ayn Rand’s Ethics,2010-12-29,Craig Biddle
The Republicans’ Opportunity to Restore America . . . and Their Obstacle,2010-11-20,Craig Biddle
The Educational Bonanza in Privatizing Government Schools,2010-11-20,Andrew Bernstein
Essay Contest Winner,2010-11-20,Craig Biddle
Andrew Carnegie: The Richest Man in the World,2010-11-20,Scott Holleran
"From the Editor, Winter 2010",2010-11-20,Craig Biddle
"Review: How Barack Obama is Endangering our National Sovereignty, by John R. Bolton",2010-11-20,Daniel Wahl
Independence vs. Second-Handedness,2010-11-03,Craig Biddle
Vladimir Shlapentokh's Flagrant Dishonesty Regarding Ayn Rand,2010-10-28,Alan Germani
Should Tea Partiers Abandon or Embrace Ayn Rand?,2010-10-21,Alan Germani
"The ""Green"" Agenda, the Cost of Energy, and the Price of Freedom",2010-10-11,Daniel Wahl
Jean Meslier on the Dearth of Knowledge Resulting from the Acceptance of Religion,2010-09-04,Craig Biddle
"From the Editor, Fall 2010",2010-08-20,Craig Biddle
The Curious Life of Richard Feynman,2010-08-20,Daniel Wahl
Herman Boerhaave: The Nearly Forgotten Father of Modern Medicine,2010-08-20,Richard G. Parker
Review: How an Economy Grows and Why It Crashes,2010-08-20,Daniel Wahl
The British Industrial Revolution: A Tribute to Freedom and Human Potential,2010-08-20,Michael Dahlen
"To Help Save America, Tea Partiers Must Fully Embrace Individual Rights",2010-08-20,Ari Armstrong
The Right to Immigrate and the Legitimacy of an Objective Screening Process,2010-08-17,Craig Biddle
Why Harry Reid Loves Social Security,2010-07-29,Daniel Wahl
"Happy Birthday, Ayaan Hirsi Ali!",2010-07-24,Daniel Wahl
Did Obama Ask the SEC to Assault Goldman Sachs?,2010-07-23,Daniel Wahl
Larry Downes Interviews Steve Simpson on Free Speech in America,2010-07-20,Craig Biddle
"There's Nothing ""Bright"" About the Stimulus Bill",2010-06-18,Daniel Wahl
Why Anthony Daniels Smears Ayn Rand,2010-05-20,Alan Germani
"Review: The Beginnings of Western Science, by David C. Lindberg",2010-05-20,Frederick Seiler
The Montessori Method: Educating Children for a Lifetime of Learning and Happiness,2010-05-20,Heike Larson
Does the SEC Care about Fraud?,2010-05-20,Daniel Wahl
"Today is ""Everybody Draw Mohammed Day""",2010-05-20,Craig Biddle
"NATO to Award ""Courageous Restraint""?",2010-05-13,Alan Germani
"Obama on ""American Democracy""",2010-05-04,Daniel Wahl
"Drawings of Mohammed, in Defense of Human Life",2010-04-28,Craig Biddle
The Government May Soon Control All Waters,2010-04-26,Daniel Wahl
How to Stand with Stone and Parker,2010-04-24,Daniel Wahl
More Clarity from the Obama Administration?,2010-04-21,Daniel Wahl
The Spring 2010 Issue of TOS,2010-03-24,Craig Biddle
Dr. Hendricks from Atlas Shrugged on Socialized Health Care,2010-03-22,Craig Biddle
Periodic Table of the Sciences,2010-03-19,Daniel Wahl
Evolutionary Theory and the Global Warming Hypothesis: A World (of Evidence) Apart,2010-03-18,Wendell Hoenir
George and Sharlee McNamee Fight to Keep Their Own Back Yard,2010-03-04,Craig Biddle
Citizens United and the Battle for Free Speech in America,2010-02-20,Steve Simpson
Norman Borlaug: The Man Who Taught People To Feed Themselves,2010-02-20,Audra Hilse
"Review: Infidel, by Ayaan Hirsi Ali",2010-02-20,Heike Larson
Nothing Less than Victory: Now Available!,2010-02-15,Craig Biddle
Virtue and the Realization of Human Life: Response to Roderick Long on Ayn Rand,2010-02-03,Wendell Hoenir
Force versus Egoism and Happiness: Response to Will Wilkinson on Ayn Rand,2010-01-25,Wendell Hoenir
The Missile Gap and the Morality Gap,2010-01-21,Wendell Hoenir
The Towering Contradiction,2010-01-18,Wendell Hoenir
2009 Front Range Objectivism Media Output,2010-01-06,Craig Biddle
'Doing Nothing' Is An Option,2009-12-15,Paul Hsieh
Objective Moral Values: Basic Human Needs,2009-11-20,Craig Biddle
"From the Editor, Winter 2009–2010",2009-11-20,Craig Biddle
The Barbary Wars and Their Lesson for Combating Piracy Today,2009-11-20,Doug Altner
Antitrust with a Vengeance: The Obama Administration’s Anti-Business Cudgel,2009-11-20,Eric Daniels
"Bob McDonnell on Liquor Stores: Right Direction, Wrong Reason",2009-11-17,Michelle Minton
Lin Gilbert's Rationing Story,2009-11-12,Paul Hsieh
The Berlin Wall and the Meaning of its Fall,2009-11-10,Craig Biddle
The Best Option For The Public,2009-11-06,Paul Hsieh
Praying Won't Make It So,2009-11-05,Stella Daily Zawistowski
Explore Atlas Shrugged,2009-10-11,Craig Biddle
"Net Neutrality Means an Unfree, Slow, and 'Stupid' Internet",2009-10-08,Raymond C. Niles
Rationally Selfish Radio with Dr. Diana Hsieh,2009-09-27,Craig Biddle
The Fall Issue of TOS,2009-09-14,Craig Biddle
Four Important Articles for this God-Awful Date,2009-09-11,Craig Biddle
Yaron Brook Interviewed by Larry Greenfield,2009-09-03,Craig Biddle
The Dire Message of Mr. David Walker,2009-08-28,John David Lewis
Activism with TOS,2009-08-22,Craig Biddle
The Rise of American Big Government: A Brief History of How We Got Here,2009-08-20,Michael Dahlen
Suppose Car Insurance Was Considered to Be a 'Right',2009-08-20,John David Lewis
How Morality is Grounded in Reality,2009-08-20,Craig Biddle
The Creed of Sacrifice vs. The Land of Liberty,2009-08-20,Craig Biddle
The Whole Foods Alternative to ObamaCare,2009-08-17,Craig Biddle
"The Health Care Bill: What HR 3200, 'America's Affordable Health Choices Act of 2009,' Says",2009-08-10,John David Lewis
"NYT Article on BB&T, John Allison, and Ayn Rand",2009-08-01,Craig Biddle
Jewish Settlements and Israeli Law,2009-07-29,John David Lewis
Summer Issue of The Objective Standard,2009-06-23,Craig Biddle
The Is–Ought Gap: Subjectivism’s Technical Retreat,2009-05-20,Craig Biddle
"From the Editor, Summer 2009",2009-05-20,Craig Biddle
Leftist Fantasy vs. the True Story of the Atomic Bombs,2009-05-02,Craig Biddle
Yaron Brook on Islamic Totalitarianism,2009-05-02,Craig Biddle
Help Fight for a Future of Reason and Freedom,2009-04-26,Craig Biddle
John David Lewis's Charlotte Tea Party Speech,2009-04-20,John David Lewis
A Snapshot of Obama's Obscene Foreign Policy,2009-04-15,Craig Biddle
The Seals Have Done What 'God' Could Not,2009-04-13,Craig Biddle
A Tea Party Without Egoism Is like a Republic Without a Chance,2009-04-05,Craig Biddle
Does My Child Know Grammar Better Than Me?,2009-04-03,Lisa VanDamme
'Atlas Shrugged and Ayn Rand’s Morality of Egoism' Now Online,2009-03-27,Craig Biddle
Yaron Brook on Ayn Rand: A Triptych,2009-03-17,Craig Biddle
"From the Editor, Spring 2009",2009-02-20,Craig Biddle
Ayn Rand’s Atlas Shrugged and the World Today: An Interview with Yaron Brook,2009-02-20,Craig Biddle
Religion vs. Subjectivism: Why Neither Will Do,2009-02-20,Craig Biddle
Altruism: The Moral Root of the Financial Crisis,2009-02-20,Richard M. Salsman
"Review: Greenspan’s Bubbles, by William A. Fleckenstein with Frederick Sheehan",2009-02-20,Joe Kroeger
Rational Science versus Sacrificial Politics,2009-01-29,John David Lewis
Why Israel Attacked the Gaza,2009-01-27,John David Lewis
Life After VanDamme Academy,2009-01-13,Lisa VanDamme
'Green' vs. Good,2009-01-09,Craig Biddle
This is Your Future on 'Universal Healthcare',2009-01-06,Craig Biddle
Capitalism and the Moral High Ground,2008-11-20,Craig Biddle
Net Neutrality: Toward a Stupid Internet,2008-11-20,Raymond C. Niles
The Assault on Energy Producers,2008-11-20,Brian P. Simpson
"From the Editor, Winter 2008–2009",2008-11-20,Craig Biddle
Demystifying Newton: The Force Behind the Genius,2008-11-20,Veronica Ryan
On Loving America,2008-10-27,John David Lewis
'A Pygmalion of the Soul',2008-10-09,Lisa VanDamme
America's Anti-America Candidates,2008-10-08,Mark V. Kormes
Urgent Call to Action: EPA Threatens Your Life,2008-09-30,John David Lewis
Urgent: Oppose Bailout of Wall Street Now,2008-09-28,Craig Biddle
Math Magic,2008-09-26,Lisa VanDamme
The Mystical Ethics of the New Atheists,2008-08-20,Alan Germani
"Mandatory Health Insurance: Wrong for Massachusetts, Wrong for America",2008-08-20,Paul Hsieh
"From the Editor, Fall 2008",2008-08-20,Craig Biddle
Israel and the Front Line of Civilization,2008-06-21,John David Lewis
Yaron Brook on the Moral Foundation of Freedom,2008-06-17,Craig Biddle
Turkey's Turn Back to the Book,2008-05-24,John David Lewis
Vindicating Capitalism: The Real History of the Standard Oil Company,2008-05-20,Alex Epstein
"From the Editor, Summer 2008",2008-05-20,Craig Biddle
"Review: Reforming Philosophy, by Laura J. Snyder",2008-05-20,John P. McCaskey
Rational Egoism in Ayn Rand's The Fountainhead,2008-04-28,Craig Biddle
An Interview with Lisa VanDamme on Education and Objectivism,2008-04-24,Craig Biddle
'Life and Taxes' by Yaron Brook,2008-04-17,Craig Biddle
Defender of Civilization: Andrew Bostom,2008-04-14,John David Lewis
Heidi Moore's Argument from Intimidation,2008-04-12,Craig Biddle
More on the Propriety of Donations with 'Strings',2008-03-31,Craig Biddle
Rational 'Strings' are Good Things,2008-03-25,Craig Biddle
An Islamist 'Declaration Against Terrorism',2008-03-23,John David Lewis
Free Speech vs. McCain and Company,2008-03-21,Craig Biddle
"Memoirs of a 'Criminal Mind': Georgia Tech, March 13, 2008",2008-03-18,John David Lewis
Remarkable Activism,2008-03-07,Craig Biddle
Caspar David Friedrich and Visual Romanticism,2008-02-20,Tore Boeckmann
"From the Editor, Spring 2008",2008-02-20,Craig Biddle
Isaac Newton: Discoverer of Universal Laws,2008-02-20,David Harriman
Darwin and the Discovery of Evolution,2008-02-20,Keith Lockitch
"Brook Takes Force to Mat, Wins",2008-02-18,Craig Biddle
Hippies + Guns = Banned Marines,2008-02-01,Craig Biddle
VanDamme Academy in the News,2008-01-28,Craig Biddle
"Health Care, Moral Rights, and Selfish Action",2008-01-09,Craig Biddle
Predatory Legislating,2007-12-05,Craig Biddle
Yesterday's Highlights: Stories From Home,2007-11-30,Lisa VanDamme
Moral Health Care vs. “Universal Health Care”,2007-11-20,Lin Zinser
"From the Editor, Winter 2007–2008",2007-11-20,Craig Biddle
Deep-Six the Law of the Sea,2007-11-20,Craig Biddle
Mere Atheism,2007-11-05,Craig Biddle
Scrutinizing Scruton's Scrutinizing,2007-11-03,Craig Biddle
Lecture: 'Atlas Shrugged and Ayn Rand's Morality of Egoism',2007-10-08,Craig Biddle
Yesterday's Highlights: 'Success',2007-10-06,Lisa VanDamme
Good Press for Objectivism and Atlas Shrugged,2007-09-28,Craig Biddle
The First Day of School: VanDamme Academy Style,2007-09-25,Lisa VanDamme
More on Ahmadinejad's Forum at Columbia,2007-09-24,Craig Biddle
Fall Issue of TOS Now Online,2007-09-21,Craig Biddle
Religion and Relativism: The Axis of Evil (Exhibit 723-B: Ahmadinejad's Visit),2007-09-21,Craig Biddle
The Economics and Ethics of Moneylending,2007-09-19,Craig Biddle
Journalistic Jabberwocky: The Classificatory Nonsense of Kay S. Hymowitz,2007-09-16,Craig Biddle
Exploit the Earth or Die,2007-08-30,Craig Biddle
Regarding the Economic Costs of my Proposed Campaign against Iran,2007-08-25,Craig Biddle
The Bush Administration's Latest Deadly Evasion,2007-08-23,Craig Biddle
How to Analyze and Appreciate Paintings,2007-08-20,Dianne Durante
The Morality of Moneylending: A Short History,2007-08-20,Yaron Brook
"From the Editor, Fall 2007",2007-08-20,Craig Biddle
Transfiguring the Novel: The Literary Revolution in Atlas Shrugged,2007-08-20,Andrew Bernstein
Mediocrities Hold Their Ground,2007-07-30,Craig Biddle
"Socialism is Anti-Life: Example # 1,375,457",2007-07-27,Bob Murphy
'Loophole': Anti-Euphemism of Statists,2007-07-25,Craig Biddle
'No Substitute for Victory' now in Hebrew,2007-07-22,John David Lewis
The Rushdie Fatwa and 'Religion vs. Free Speech',2007-06-23,Craig Biddle
Doctor Defends Freedom in Medicine,2007-06-04,Craig Biddle
The VanDamme Academy Field Trip,2007-05-29,Lisa VanDamme
The Writing Process: One Step at a Time,2007-05-22,Lisa VanDamme
"From the Editor, Summer 2007",2007-05-20,Craig Biddle
"“The Balm for a Guilty Conscience”: Moral Paralysis, Appeasement, and the Causes of World War II",2007-05-20,John David Lewis
Neoconservative Foreign Policy: An Autopsy,2007-05-20,Yaron Brook
The Failure of Field Trips,2007-05-03,Lisa VanDamme
