title,date_published,author_name
A New Window on Scriabin,2019-01-17,Timothy Sandefur
John Singer Sargent: Master of Elevated Grace,2019-01-11,Timothy Sandefur
Why Praise the Rose Parade,2019-01-03,Timothy Sandefur
Minding Your Time: Three Ideas,2018-12-29,Jon Hersey
A Life-Enhancing Lesson from Dickens’s Christmas Carol,2018-12-24,Jon Hersey
Environmentalists’ Marching Orders for Human Extinction,2018-12-21,Craig Biddle
The Illusion of Determinism: Why Free Will Is Real and Causal by Edwin A. Locke,2018-12-19,Jeffrey Falk
In Order to Live: A North Korean Girl's Journey to Freedom by Yeonmi Park with Maryanne Vollers,2018-12-14,Anna Franco
Why a “Right” to Health Care is a Moral Travesty,2018-12-14,Jon Hersey
Four Fallacies Regarding the Political Spectrum,2018-12-06,Craig Biddle
A Dozen Christmas Gift Suggestions for Fans of Ayn Rand,2018-12-05,Timothy Sandefur
The Moral Courage of Rosa Parks,2018-11-29,Jon Hersey
Public Land’s Collectivist Roots,2018-11-20,Jon Hersey
The Need for Philosophy in the Islands of the Blessed,2018-11-20,Timothy Sandefur
The Mind-Based Etymology of ‘Capitalism’,2018-11-20,Richard M. Salsman
"Remember, Remember, the Ninth of November",2018-11-08,Jon Hersey
Ayn Rand’s Method for Slaying Monsters,2018-10-31,Jon Hersey
Europe Wades Further into Sharia Law,2018-10-31,Craig Biddle
The Tree of Life Massacre: Murder of the Good for Being Good,2018-10-29,Craig Biddle
How to Challenge Racism in College Admissions,2018-10-25,Jon Hersey
What Justice Demands: America and the Israeli-Palestinian Conflict by Elan Journo,2018-10-18,Julian Hook
You can now watch and share TOS-Con 2018 videos on YouTube!,2018-09-20,Craig Biddle
Nature’s God: The Heretical Origins of the American Republic by Matthew Stewart,2018-09-20,Brian Tebbitt
Dr. Josh Umbehr on the Rapid Growth of Direct Primary Care,2018-09-15,Tim White
"Marva Collins, Her Method, and Her ‘Philosophy for Living’",2018-08-30,Carrie-Ann Biondi
The Human Flourishing Project Podcast: Incredible Value for ‘Students of Life’,2018-08-24,Jon Hersey
TOS and ARI Have Resumed Cooperation,2018-08-24,Craig Biddle
Will you help TOS fight for your values?,2018-08-14,Craig Biddle
Mark Pellegrino on the American Capitalist Party,2018-08-13,Craig Biddle
Heroes and Villains in American Education,2018-08-13,Andrew Bernstein
Sequoyah and the Vital Nature of the Written Word,2018-08-13,Timothy Sandefur
Implications of and Objections to Life as the Standard,2018-08-02,Craig Biddle
Identity Politics vs. the Law of Identity,2018-08-02,Craig Biddle
Einstein’s Pivotal Letter to FDR,2018-08-01,Jon Hersey
When I met Alex Epstein . . . and why you should attend TOS-Con,2018-07-30,Craig Biddle
Bad Blood: Secrets and Lies in a Silicon Valley Startup by John Carreyrou,2018-07-26,Nicholas Provenzo
Facts and Values: What’s the Connection?,2018-07-26,Craig Biddle
An Open Letter to Advocates of Identity Politics,2018-07-19,Craig Biddle
"“Facts, Values, and Flourishing”: A New Video Series",2018-07-17,Craig Biddle
"The Right to Try, to Hope, to Live",2018-07-10,Christina Sandefur
The Declaration of Independence Is the Moral and Legal Foundation of America,2018-07-02,Timothy Sandefur
How to apply principles of rational egoism to make your life the best it can be,2018-06-28,Craig Biddle
"Nikki Haley: Confronting Murderous Regimes and Their Accomplice, the UN",2018-06-23,Jon Hersey
Tommy Robinson’s Right to Free Speech Morally Trumps All Laws That Violate It. (Even That One.) — UK Version,2018-06-19,Craig Biddle
Donald Trump and Kim Jong-un: Enemies of Human Life,2018-06-16,Craig Biddle
Tommy Robinson’s Right to Free Speech Morally Trumps All Laws That Violate It. (Even That One.),2018-06-09,Craig Biddle
The Horrific Injustice against Tommy Robinson and Free Speech,2018-05-30,Peter Seferian
Principles of the Liberal Right,2018-05-24,Craig Biddle
"From the Editor, Summer 2018",2018-05-24,Craig Biddle
The Brooklyn Bridge: A Monument to the Human Spirit,2018-05-24,Robert Begley
"Happy Birthday, Sir Arthur Conan Doyle!",2018-05-22,Jon Hersey
"Sophie, by Tal Tsfany",2018-05-18,Ella Wilson
Resources for Advancing Objectivism,2018-05-18,Craig Biddle
"Happy Birthday, Israel! (And Kudos to the Trump Administration)",2018-05-14,Craig Biddle
Little Pink House: Dramatizing the Horror of Eminent Domain,2018-05-02,Nicholas Provenzo
‘No Man Swings More or Stands Higher than the Duke’,2018-04-29,Robert Begley
Want a Fun Way to Keep Up with Trump’s Ridiculous Tweets?,2018-04-26,Jon Hersey
James Shaw Jr.’s Heroism and Objective Morality,2018-04-26,Craig Biddle
Benjamin Franklin: The Enlightenment Personified,2018-04-26,Jon Hersey
The Genius of James Madison,2018-04-19,Timothy Sandefur
Jackie Robinson: ‘The Best Kind of American Hero’,2018-04-15,Robert Begley
Henry Hazlitt in One Lesson,2018-04-13,Tom Malone
John Lautner and Real Architecture,2018-04-05,Betsy Speicher
Toastmasters: A Means to Actualize Your Potential and Improve the Culture,2018-04-05,Robert Begley
"Tal Tsfany on Sophie, the Book",2018-04-04,Craig Biddle
"The Big Lie: Exposing the Nazi Roots of the American Left, by Dinesh D’Souza",2018-03-28,Tom Malone
Dave Rubin and the Argument from Depravity,2018-03-22,Jonathan Townley
"Patrick Henry’s ‘Give Me Liberty, or Give Me Death!’ Speech",2018-03-22,Robert Begley
Google’s Triumph of Relevance over Stickiness,2018-03-20,Jon Hersey
Robert Reich’s Unoriginal Smear against Ayn Rand—and Its Silver Lining,2018-03-16,Nicholas Provenzo
"Free Speech, Property, and the Right to Discriminate",2018-03-15,Ryan Puzycki
"'Blink, Think, Choice, Voice': A Way for Children to Protect Themselves",2018-03-13,Craig Biddle
Hamilton’s Bank of New York Put the City Back in Business and the U.S. on the Map,2018-03-13,Robert Begley
"The New York Post Disgraces Itself, Lauds William F. Buckley",2018-03-11,Harry Binswanger
‘Act Worthy of Yourselves’: Joseph Warren on Defending Liberty,2018-03-06,Tom Malone
Henry Ford on the Justice of Income Inequality,2018-03-06,Jon Hersey
Derek Magill on Building a Career You’ll Love,2018-02-28,Jon Hersey
"William F. Buckley: Cowardly, Dishonest, Unjust, Racist, and Loved by Conservatives",2018-02-27,Craig Biddle
"Happy Birthday, George Washington!",2018-02-22,Jon Hersey
Robert Ingersoll: Intellectual and Moral Atlas,2018-02-21,Tom Malone
"From the Editor, Spring 2018",2018-02-21,Craig Biddle
Frederick Douglass’s Vision of Manhood,2018-02-21,Timothy Sandefur
Self-Made Men,2018-02-21,Frederick Douglass
Say’s Law and Networking,2018-02-20,Craig Biddle
Why TOS-Con 2018 Is for You,2018-02-18,Craig Biddle
TOS-Con 2018 and the Value of Interaction,2018-02-18,Craig Biddle
Nine Beautiful Poems on Romantic Love,2018-02-12,Various Authors
Ben Shapiro and the Garbage Smear,2018-02-12,Craig Biddle
Here’s What’s Wrong with Ayn Rand’s Philosophy,2018-02-08,Craig Biddle
Alex Epstein on the Power of Opinion Stories,2018-01-28,Jon Hersey
RooseveltCare: How Social Security Is Sabotaging the Land of Self-Reliance by Don Watkins,2018-01-24,Jon Hersey
Altruism on Parade: Unity in the “March for Life” and the Women’s March,2018-01-23,Ryan Puzycki
"‘Shithole Countries,’ Moral Ambitiousness, and Economic Parallels",2018-01-17,Craig Biddle
"Contra Ben Shapiro, Rational Self-Interest Is Not Hedonism",2018-01-10,Craig Biddle
Craig Biddle Live: Meaning and Morality in a Godless Universe,2018-01-10,Craig Biddle
‘It Was Time for Every Man to Stir’: Thomas Paine’s Common Sense,2018-01-10,Jon Hersey
Live Free or Die: The Story of General John Stark,2018-01-04,Jon Hersey
The U.S. Government Must Support the Iranian Protesters,2018-01-04,Craig Biddle
Jon Wos: Lighting the Darkness,2017-12-31,Nicholas Provenzo
Alma Deutscher the First,2017-12-29,Betsy Speicher
The Boston Tea Party’s Principles and Heroes,2017-12-16,Jon Hersey
Carrie-Ann Biondi on Ayn Rand’s Enduring Appeal,2017-12-12,Jon Hersey
Don’t Draft Women—Don’t Draft Anyone,2017-12-06,Mike Cronin
"On Writing Well: The Classic Guide to Writing Nonfiction, Seventh Edition, by William Zinsser",2017-12-06,Jon Hersey
The Supreme Court’s Opportunity to Legalize Privacy,2017-11-27,Amy Peikoff
"The Vanishing American Adult, by Ben Sasse",2017-11-25,Ryan Puzycki
Thirteen Previously Unpublished Letters of Ayn Rand,2017-11-25,Michael Berliner
When the ‘Right to Protest’ Is No Such Thing,2017-11-25,Jonathan Townley
"A Dearth of Eagles, by Andrew Bernstein",2017-11-25,Yvonne Laplante
"The Internet of Money, by Andreas M. Antonopoulos",2017-11-25,Michael Dahlen
"From the Editor, Winter 2017–2018",2017-11-25,Craig Biddle
Eight Great Poems on Perseverance and Success,2017-11-25,Various Authors
Wilberforce the Abolitionist: Monument to Perseverance,2017-11-25,Jon Hersey
"Intelligent Disobedience, by Ira Chaleff",2017-11-25,Craig Biddle
A Plea for Voluntaryism,2017-11-24,Auberon Herbert
The Federalist Essays Brought the U.S. Constitution to Life,2017-10-27,Robert Begley
Several TOS Articles Now Available in Portuguese,2017-10-17,Ezra Drake
Nobel Prize Awarded to Kazuo Ishiguro—Kindred Spirit of Balph Eubank (from Ayn Rand’s Atlas Shrugged),2017-10-10,Jon Hersey
"Lt. Gen. Silveria’s Stand Against Racism, and His Unfortunate Paean to “Diversity”",2017-10-03,Jon Hersey
The Rubin Report Addresses Free Speech via Panel at Harvard,2017-09-20,Craig Biddle
Freedom of Speech Is Freedom to Think,2017-09-19,Craig Biddle
Seven Poems on Living Large and Loving Life,2017-09-03,Various Authors
Alex Epstein on An Inconvenient Sequel and Al Gore’s Methods of Deception,2017-09-03,Craig Biddle
"Isaac Morehouse on Praxis, Apprenticeships, and Creating Value",2017-09-03,Craig Biddle
Thomas Jefferson: Word and Deed,2017-09-03,Jon Hersey
A Note to the Right Regarding the “Alt-Right”,2017-08-22,Craig Biddle
Questions about Jihad on Children,2017-05-28,Craig Biddle
Captain Cook: Explorer of the Enlightenment,2017-05-21,Timothy Sandefur
"Egoism, Benevolence, and Generosity",2017-05-21,Craig Biddle
Seven Great Poems on Independence,2017-05-21,Various Authors
"Nuggets of Note - May 3, 2017",2017-05-03,Craig Biddle
Ben Shapiro Denies and Affirms the Law of Identity,2017-05-01,Craig Biddle
"The Poor, Disabled, and Helpless Under Capitalism",2017-04-26,Craig Biddle
The Shapiro Principle: A Godsend for Lovers of Liberty,2017-04-26,Craig Biddle
"Reason and Capitalism, or Unreason and Environmentalism: Choose Wisely",2017-04-21,Craig Biddle
Ron Chernow Gets “America at Her Best Is Hamiltonian”,2017-04-13,Craig Biddle
The Muddy Waters of the Nolan Chart,2017-04-13,Craig Biddle
Richard M. Salsman’s The Political Economy of Public Debt Is Now Available,2017-04-05,Craig Biddle
"Secular, Objective Morality: Look and See",2017-04-03,Craig Biddle
Ayn Rand Included on A-Level Curriculum in UK,2017-03-28,Craig Biddle
Dennis Prager’s Faith Meets Jihad in the Name of “God”,2017-03-22,Craig Biddle
Bill Nye’s Golden Opportunity to Crush the Fossil Fuel Industry,2017-03-13,Craig Biddle
A Graphic Novel based on Ayn Rand’s Atlas Shrugged,2017-03-09,Craig Biddle
The Vital Function of the Left-Right Political Spectrum,2017-03-08,Craig Biddle
America at Her Best Is Hamiltonian,2017-02-21,Richard M. Salsman
Ayn Rand Contra Nietzsche,2017-02-21,John Ridpath
National Review’s MO Regarding Ayn Rand,2016-12-15,Craig Biddle
"Vaccine Facts, Falsehoods, and Best Policies",2016-11-20,Joseph England
Ayn Rand’s Intellectual Development,2016-11-20,Michael Berliner
America’s Next Leftist President: Donald Trump,2016-11-15,Craig Biddle
"Bad Parenting, Bad Education, and the State of America",2016-11-02,Craig Biddle
9/11 and America’s Failure to End the Jihad,2016-09-11,Craig Biddle
Weighing Gary Johnson for President,2016-08-29,Craig Biddle
The Roots of Capitalism and Statism in the West,2016-08-14,Michael Dahlen
The Socialist Holocaust and its American Deniers,2016-08-14,Andrew Bernstein
"The Cave and the Light: Plato Versus Aristotle, and the Struggle for the Soul of Western Civilization, by Arthur Herman",2016-08-14,Jon Hersey
Individual Rights and Principles of Egoism,2016-08-06,Craig Biddle
Reclaiming Spirituality for Lovers of Life,2016-07-30,Craig Biddle
Richard M. Salsman on Caricatures of Self-Interest,2016-07-16,Craig Biddle
Liberal Right vs. Regressive Left and Religious “Right”,2016-07-12,Craig Biddle
Dave Rubin and the Return of Classical Liberalism,2016-06-10,Craig Biddle
"Hillary, Johnson, and Trump, Oh My!",2016-06-09,Craig Biddle
A Report on “Capitalism: Unlocking Human Potential”,2016-06-02,Craig Biddle
Three Great Modern Poets,2016-05-20,Timothy Sandefur
Robin Field on Objectivism and the Performing Arts,2016-05-20,Craig Biddle
"How Conservatives Begat Trump, and What to Do About It",2016-05-14,Craig Biddle
"Religion, a “Sophie’s Choice,” and an Easy Choice",2016-05-07,Craig Biddle
“Ayn Rand Said” Is Not an Argument,2016-04-22,Craig Biddle
Alex Epstein on How Fossil Fuels Make the Environment Cleaner and Safer,2016-04-21,Craig Biddle
Why Religious Conservatives Should Embrace Secular Rights,2016-04-19,Craig Biddle
Alex Epstein Gives U.S. Senate a Humanist Perspective on Fossil Fuels and Climate,2016-04-12,Craig Biddle
Alex Epstein’s Prescriptions for Republican Success on Energy,2016-04-12,Craig Biddle
Dennis Prager’s False Alternative and Ayn Rand’s Philosophy of Life,2016-04-11,Craig Biddle
Alex Epstein’s Principled Mind in Motion,2016-04-05,Craig Biddle
Ted Cruz for President,2016-04-02,Craig Biddle
The Teenager’s Guide to the Morality of Self-Interest,2016-03-21,Craig Biddle
Donald Trump and the Anti-Reason Essence of Conservatism,2016-02-01,Stuart K. Hayashi
"Theist Embraces Ayn Rand’s Theory of Rights, Urges Others to Do So Too",2016-01-22,Craig Biddle
Help TOS Fight For Your Values,2015-12-30,Craig Biddle
For the Love of Christmas,2015-12-20,Craig Biddle
Daniel Kaufman: Life Taken by Jihad,2015-12-15,Craig Biddle
"Israel: To Be, or Not to Be",2015-12-12,Craig Biddle
Doug Peltz on Science Education and Mystery Science,2015-12-12,Daniel Wahl
Ten Steps to End Jihad Against the West,2015-11-29,Craig Biddle
"Pope Francis, Religion, Capitalism, and Ayn Rand",2015-09-24,Craig Biddle
Objectivism and Parenting,2015-09-16,Craig Biddle
A Dozen Great Books for Young Children,2015-09-03,Daniel Wahl
"From the Editor, Fall 2015",2015-09-03,Craig Biddle
How To Raise a Life-Loving Child,2015-09-03,Sarah Biddle
"The Wright Brothers, by David McCullough",2015-09-03,Daniel Wahl
The Cause of the Civil War According to Confederate Leaders,2015-09-03,Richard Shedenhelm
The U.S. Treasury’s Unjust Debasement of Alexander Hamilton,2015-07-07,Richard M. Salsman
The “Ayn Rand Equals Joseph Stalin” Smear,2015-06-30,Ari Armstrong
"Yes, Conservatives, Islam Is a Religion",2015-06-21,Craig Biddle
"Fox News, Dhimmi-America, and Your America",2015-05-31,Craig Biddle
Bosch Fawstin on Islam and Jihad,2015-05-21,Craig Biddle
Lessons of the Armenian Genocide,2015-05-21,Andrew Bernstein
U.S. Foreign Policy: What’s the Purpose?,2015-05-21,Craig Biddle
The Autobiography of Benjamin Franklin,2015-05-21,Kirk Barbera
The New Testament Versus the American Revolution,2015-05-21,James Valliant
"From the Editor, Summer 2015",2015-05-20,Craig Biddle
A Parable for Thomas Piketty,2015-05-06,Ari Armstrong
"The Obama Doctrine: Aid America’s Enemies, Throttle Her Friends",2015-04-08,Craig Biddle
"Thomas Sowell: ""Comparing Obama to Chamberlain is Unfair—to Chamberlain""",2015-04-07,Craig Biddle
A Penny for Your Thoughts: “Liberty Parent of Science & Industry”,2015-03-30,Craig Biddle
Ted Cruz’s Presidential Campaign Launch: Good and Bad,2015-03-24,Craig Biddle
Simon Sinek’s Start with Why Shows What Distinguishes Great Business Leaders,2015-03-20,Kirk Barbera
Grand Budapest Hotel Worth a Visit,2015-03-19,Ari Armstrong
Whiplash and the Quest for Greatness,2015-02-28,Ari Armstrong
"The Moral Case for Fossil Fuels, by Alex Epstein",2015-02-20,Ari Armstrong
Islamic Jihad and Western Faith,2015-02-19,Craig Biddle
"From the Editor, Spring 2015",2015-02-19,Craig Biddle
Ryan Holiday’s The Obstacle Is the Way: A Toolbox for Success,2015-01-26,Kirk Barbera
Charlie Hebdo’s Moral Endurance,2015-01-13,Craig Biddle
Spiritual Complicity in Islamic Atrocities,2015-01-11,Craig Biddle
In Support of Charlie Hebdo and Freedom of Speech,2015-01-08,Craig Biddle
A Screenplay Jihadists will Hate and Civilized People will Love,2014-12-30,Daniel Wahl
Bergdorf Goodman’s Christmas Windows Celebrate Art and Capitalism,2014-12-17,Joseph Kellard
Alex Epstein’s The Moral Case for Fossil Fuels: A High-Test Success,2014-12-14,Ari Armstrong
The Equality Equivocation,2014-11-20,Craig Biddle
Alex Epstein Discusses the Moral Case for Fossil Fuels,2014-11-20,Ari Armstrong
Chef,2014-11-20,Ari Armstrong
Got Food? Thank the Fossil Fuel Industry,2014-11-19,David Biederman
"From the Editor, Winter 2014–15",2014-11-19,Craig Biddle
The Keystone XL and Senators Who May Need to Go,2014-11-17,David Biederman
Alex Epstein’s The Moral Case for Fossil Fuels,2014-11-13,Ari Armstrong
"Thank You, Veterans",2014-11-11,Craig Biddle
Election 2014: Victories and Defeats for Individual Rights,2014-11-05,Ari Armstrong
Obama and Dems Dishonestly Claim Credit for Increased Oil Production,2014-11-04,David Biederman
FBI Director Asks Congress to Pry Open New Spy-Resistant Smartphones,2014-10-30,Ezra Drake
In Memory of Bruce Rickard,2014-10-29,Robert Begley
"Lower Gasoline Prices? Thank you, Oil Industry!",2014-10-27,David Biederman
The Evil of Whitewashing Islam,2014-10-26,Craig Biddle
Anniversary of the Iran-Sponsored Murder of 241 Americans in Lebanon,2014-10-24,Craig Biddle
Krugman to Amazon: All Your Books Are Belong to Us,2014-10-23,Ari Armstrong
"After Snowden’s Leaks, Apple Locked iPhone’s Back Door and Threw Away the Key",2014-10-22,Ezra Drake
"From the Editor, Fall 2014",2014-10-16,Craig Biddle
"Citizens United’s Colorado Documentary Is Protected Speech, Tenth Circuit Rules",2014-10-15,Ari Armstrong
"Sam Harris States the Obvious about Islam, Enrages Ben Affleck",2014-10-13,Ari Armstrong
Colorado Judge: Today’s “Tom Paine’s Pamphlet” Is Protected Speech,2014-10-12,Ari Armstrong
Caroline Glick and Michael Ledeen on a Golden Opportunity Regarding Iran,2014-10-11,Craig Biddle
State Department Endorses Handbook Calling Jihad “Noble”,2014-10-08,Craig Biddle
Richard Berenholtz on Photographing the Rise of 432 Park Avenue,2014-10-04,Joseph Kellard
The Causes of War and Those of Peace,2014-10-02,Craig Biddle
FEE Debate: Is Liberty Best Defended with One Moral Foundation or Many?,2014-09-24,Craig Biddle
"Citizens United, Anonymous Speech, and Rights-Violating Disclosure Laws",2014-09-18,Ari Armstrong
In Honor of the U.S. Constitution and the Men Who Created It,2014-09-17,Robert Begley
Concrete: The Foundation of Modern Life,2014-09-16,Ari Armstrong
Atlas Shrugged III: Who Is John Galt?—The Bad and the Good of It,2014-09-13,Ari Armstrong
"Sam Harris: Yes, Islamic Jihadists Are Motivated by Religion",2014-09-12,Ari Armstrong
Obama on Islamic State: Pretend Islam Is Not Islam,2014-09-11,Ari Armstrong
The Jihad Against America and How to End It,2014-09-10,Craig Biddle
Glenn Reynolds and the “Problem” of Income Inequality,2014-09-09,Ari Armstrong
"Police Morally Must Protect, Not Violate Rights",2014-09-08,Ari Armstrong
Andrew Klavan and Bill Whittle Pretend to Analyze Ayn Rand,2014-09-07,Ari Armstrong
Endangered Species Act Sacrifices People to Frogs,2014-09-06,Ari Armstrong
Mexico’s Oil Monopoly Looks to U.S. for Crude Oil Resulting from Non-Monopoly,2014-09-05,David Biederman
Kids React to Apple II: “Look at How Humanity Has Used Their Intellect!”,2014-09-05,Ari Armstrong
Speech Isn’t Free when Government Requires Speakers to Register and Report,2014-09-04,Ari Armstrong
Burgess Laughlin: A Man who Made Progress,2014-08-30,Craig Biddle
"Contra Colorado Pastor, Sex Among Older Teens Can Be Moral and Healthy",2014-08-28,Ari Armstrong
Ice-Bucket Challenge Supports Embryonic Stem Cell Research—And That’s a Good Thing,2014-08-28,Ari Armstrong
Government to Patients: “We Feel Pain Is Best for You”,2014-08-27,Ari Armstrong
"Contra Time Writer’s Claim, Ayn Rand Did Not Advocate Mooching Coffee (or Anything Else)",2014-08-25,Ari Armstrong
"The Rape of the Masters, by Roger Kimball",2014-08-20,Daniel Wahl
"The Martian, by Andy Weir",2014-08-20,Ari Armstrong
Review: Star Trek: First Contact,2014-08-20,Ari Armstrong
Donna Hassler on the Sculptures of Daniel Chester French,2014-08-20,Joseph Kellard
Moral Diversity: Asset or Liability for Liberty?,2014-08-20,Craig Biddle
Edge of Tomorrow,2014-08-20,Ari Armstrong
"The Dictionary of Human Form, by Ted Seth Jacobs",2014-08-20,Daniel Wahl
The Jihad against Robin Williams Speaks Volumes,2014-08-13,Ari Armstrong
“Gifts from Heaven”: A Vital Historic Lesson for America,2014-08-11,Craig Biddle
European Industry Stagnates as Americans Prosper with Fracking,2014-08-08,David Biederman
The Environmentalists’ War on People,2014-08-04,Ari Armstrong
What Congress Should Do Rather than Sue,2014-08-01,Ari Armstrong
Paul Ryan’s “Anti-Poverty” Program and What America Needs in this Vein,2014-07-30,Ari Armstrong
An interview with Rachel Miner about Learning at Our House,2014-07-28,Robert Begley
"Lumni: Rights-Respecting, Profit-Driven Financing for College Students",2014-07-27,Michael A. LaFerrara
Amazon Admirably Mocks Unjust French Law,2014-07-25,Aaron Fried
"ObamaCare, Nonobjective Law, and Brothers’ Keepers",2014-07-24,Ari Armstrong
Jason Brennan Joins the Brigade of People Misrepresenting Ayn Rand’s Views,2014-07-23,Daniel Wahl
Now Multiple IRS Hard Drives Crashed—Coincidence?,2014-07-22,Craig Biddle
Why You and I and Everyone Should Support Israel Against the Barbarians,2014-07-21,Craig Biddle
"Contra Senator Udall, America Needs a “Not the Government’s Business Act”",2014-07-21,Ari Armstrong
Myths and Facts about a Rights-Respecting Immigration Policy,2014-07-20,Ari Armstrong
Government Should Neither Finance Colleges Nor Dictate What They Teach,2014-07-19,Ari Armstrong
"Interview with Keith Schacht, Co-Founder of Mystery Science",2014-07-17,Daniel Wahl
Ted Cruz Champions Right to Free Speech,2014-07-16,Ari Armstrong
Kudos to Israel for Taking Steps to Defend Its Citizens Against Hamas,2014-07-15,Ari Armstrong
The Real Costs of the Government’s “Net Zero Energy” House,2014-07-14,Ari Armstrong
Mass Illegal Immigration of Central American Children: A U.S.-Created Crisis,2014-07-10,Ari Armstrong
Rights-Respecting Immigration Policy and Muslims,2014-07-09,Ari Armstrong
The Left’s Pragmatic Shift in Marketing is a Good Sign,2014-07-09,Michael A. LaFerrara
"No, Virginia, There Is No Moral Right to Throttle Uber",2014-07-07,Anoop Verma
Teen Drives Research of Her Own Disease,2014-07-06,Varun Parameswaran
What to Celebrate on Independence Day,2014-07-04,Craig Biddle
"Ban the FDA, Not Wood-Aged Cheese",2014-06-30,Ari Armstrong
Lifelike Androids are Improving People’s Lives Today,2014-06-29,Anoop Verma
"Coal Fuels China’s Economic Growth, Enables Americans’ Enjoyment Thereof",2014-06-28,David Biederman
New “Neurobridge” Technology Enables Quadriplegic to Move Hand,2014-06-27,Aaron Fried
"Auberon Herbert: Advocate of Reason, Individual Rights, and Limited Government",2014-06-26,Craig Biddle
"Restrain Bureaucratic Thugs, Not Agricultural Drones",2014-06-25,Ari Armstrong
Altruism: The Fuel of Jihad,2014-06-24,Craig Biddle
Iran Unsurprisingly “Celebrates” World Cup by Arresting Celebrants,2014-06-23,Ari Armstrong
Economists’ “Subjective Value” and Ayn Rand’s Objective Value Reconciled,2014-06-22,Ari Armstrong
“Ministries of Truth”: An Ominous Possibility in America,2014-06-20,Ari Armstrong
Is ObamaRetire Next?,2014-06-19,Ari Armstrong
BP Drone Makes Oil Production Safer and More Profitable,2014-06-17,David Biederman
Nureyev Danced Free of Communism and Lived,2014-06-16,Robert Begley
Ayn Rand Was Right: Cats Are Objectively Valuable,2014-06-15,Ari Armstrong
"Homosexuality, the Bible, and Rational Morality",2014-06-14,Ari Armstrong
Check Your Statist Privilege,2014-06-13,Ari Armstrong
Dave Brat and Ayn Rand on Rights and Government,2014-06-12,Ari Armstrong
Environmentalists Succeed in Sabotaging Prosperity,2014-06-11,David Biederman
"Life Imitates Atlas Shrugged in Austin, Texas",2014-06-10,Ari Armstrong
"Ohio Anti-Fracking Group Attacks Individual Rights, Promises to Continue",2014-06-09,David Biederman
“White Privilege”: Myths and Facts,2014-06-08,Ari Armstrong
"Gabe Sonnier: Janitor, Principal, Inspiration",2014-06-07,Derrick Nantz
Racists Fighting “White Privilege”,2014-06-07,Ari Armstrong
UK’s Regressive Energy Policies,2014-06-05,David Biederman
Microsoft’s Universal Translator: Fruit of Massive Profits,2014-06-04,Ari Armstrong
American Spirit Alive and Well in North Dakota,2014-06-03,David Biederman
Rand’s Ethics and Say’s Law,2014-06-02,Craig Biddle
Sunstein Sees “Opportunity” in China’s Indoctrination Efforts,2014-06-01,Ari Armstrong
Russia’s Useful Environmentalists,2014-05-31,David Biederman
Walter Mitty Learns to Love His Life,2014-05-30,Ari Armstrong
“Citizens for Tax Justice” vs. Rational Patriotism,2014-05-30,Michael A. LaFerrara
Lincoln and Race,2014-05-29,Alexander V. Marriott
"A Report on the “Liberty, Free Markets, and Moral Character” Conference",2014-05-28,Craig Biddle
"At World Cup Opening Ceremony, a Paraplegic Will Walk—Thanks to Miguel Nicolelis and Co",2014-05-27,Derrick Nantz
"On Memorial Day, Let’s Lift Our Heads and Speak",2014-05-26,Craig Biddle
It Really Is About Time,2014-05-25,Ari Armstrong
Egalitarianism versus Rational Morality on Income Inequality,2014-05-24,Ari Armstrong
Monuments Men Saved Master Artworks from Grip of Nazis,2014-05-23,Ari Armstrong
